{
  "id": "official-ipo-calendar",
  "sender": "채움증권",
  "handle": "공식 앱 알림",
  "channel": "앱 알림",
  "mode": "notice",
  "preview": "이번 주 공모주 일정이 등록되었습니다.",
  "verdict": "normal",
  "category": "정상 공모주 일정 안내",
  "initialMessages": [
    "관심 일정에 등록한 가상기업의 공모주 청약 기간이 이번 주에 시작됩니다.",
    "청약 여부는 공식 앱에서 투자설명서와 배정 방식을 확인한 뒤 직접 결정하세요. 이 알림은 입금이나 개인정보 입력을 요구하지 않습니다."
  ],
  "role": "공식 증권 앱의 공모주 일정 알림",
  "npcGoal": "등록한 관심 일정과 공식 투자설명서 확인 경로를 안내한다.",
  "allowedClaims": ["공식 앱의 관심 일정과 일치", "투자설명서 확인 권고", "외부 송금이나 개인정보 요구 없음"],
  "checks": {
    "home": "공식 증권 앱의 관심 일정에 같은 가상기업과 청약 기간이 등록돼 있습니다.",
    "library": "직접 확인한 공시 자료의 일정과 주관 정보가 앱 안내와 일치합니다."
  },
  "clueLabels": ["직접 연 공식 앱의 등록 일정과 일치", "외부 계좌·링크·개인정보 요구 없음"],
  "debrief": "사용자가 등록한 관심 일정에 따라 온 정상적인 공식 앱 안내입니다. 공모주라는 단어만으로 사기라고 단정하지 말고 발신 경로와 독립 공시를 확인해야 합니다.",
  "safeAction": "공식 증권 앱과 공시 자료에서 일정과 투자 위험을 확인한 뒤 스스로 청약 여부를 결정합니다.",
  "review": {
    "sourceBasis": ["증권사가 공식 앱에서 관심 공모주 일정과 투자설명서 확인을 안내하는 일반적인 정상 알림"],
    "adaptationScope": "실존 기업, 증권사, 청약 가격과 날짜를 사용하지 않고 정상 확인 구조만 가상화했습니다.",
    "verdictReason": "직접 연 공식 앱과 독립 공시에서 같은 일정이 확인되고 외부 송금이나 정보 요구가 없습니다.",
    "verificationPaths": ["공식 증권 앱의 관심 일정 직접 확인", "공시 자료에서 청약 일정과 주관 정보 대조"],
    "misdirection": ["앞선 공모주 사기 경고 때문에 정상 공모주 안내도 사기로 과잉 판단할 수 있음"],
    "learningObjectives": ["공모주라는 소재가 아니라 발신 경로와 요청 행동을 확인한다", "정상 안내도 독립 공시와 비교하는 습관을 익힌다"],
    "safetyAudit": { "containsPersonalData": false, "containsLiveUrl": false, "containsOperationalCrimeInfo": false }
  }
}
