{
  "id": "official-maintenance",
  "sender": "푸른투자",
  "handle": "공식 앱 공지",
  "channel": "앱 알림",
  "mode": "notice",
  "preview": "주말 시스템 점검으로 일부 서비스가 중단됩니다.",
  "verdict": "normal",
  "category": "정상 서비스 공지",
  "initialMessages": [
    "토요일 01:00~05:00 시스템 점검으로 주문 정정과 이체 서비스가 일시 중단됩니다.",
    "점검 일정은 공식 홈페이지와 앱 공지사항에서도 확인할 수 있습니다."
  ],
  "role": "공식 금융 앱의 시스템 점검 안내",
  "npcGoal": "점검 일정을 알리고 공식 공지를 확인하게 한다.",
  "allowedClaims": ["공식 공지와 동일", "송금이나 개인정보 요구 없음"],
  "checks": {
    "home": "공식 앱 공지사항에 동일한 점검 일정이 있습니다.",
    "library": "직접 입력한 공식 홈페이지 주소에서도 같은 공지가 확인됩니다."
  },
  "clueLabels": ["두 개의 독립적인 공식 채널에서 확인", "입금·인증 요구 없음"],
  "debrief": "정상적인 시스템 점검 공지입니다. 서비스 중단이나 급한 표현 자체는 사기의 증거가 아닙니다.",
  "safeAction": "직접 공식 앱이나 홈페이지의 공지사항을 확인합니다.",
  "review": {
    "sourceBasis": ["금융 서비스가 점검 시간과 중단 기능을 사전에 알리는 일반적인 정상 공지"],
    "adaptationScope": "회사명, 날짜와 점검 시간을 가상화하고 실제 서비스 주소는 넣지 않았습니다.",
    "verdictReason": "직접 연 공식 앱과 사용자가 입력한 공식 홈페이지에서 같은 공지를 확인할 수 있고 정보·송금 요구가 없습니다.",
    "verificationPaths": ["직접 연 공식 앱의 공지사항", "사용자가 직접 찾은 공식 홈페이지 공지"],
    "misdirection": ["서비스 중단 문구만 보고 위기 상황이나 사기로 과잉 해석할 수 있음"],
    "learningObjectives": ["정상 공지도 독립적인 공식 채널에서 확인한다", "불안한 문구보다 요청 행동과 확인 가능성을 본다"],
    "safetyAudit": { "containsPersonalData": false, "containsLiveUrl": false, "containsOperationalCrimeInfo": false }
  }
}
