{
  "id": "paid-market-class",
  "sender": "월가읽기 클래스",
  "handle": "스폰서 콘텐츠",
  "channel": "SNS",
  "mode": "link",
  "preview": "주식 기초 강의 얼리버드 40% 할인",
  "verdict": "caution",
  "category": "과장된 투자 교육 광고",
  "initialMessages": [
    "초보 투자자를 위한 4주 온라인 강의입니다. 오늘까지 얼리버드 할인이 적용됩니다.",
    "수강한다고 수익이 보장되지는 않으며 모든 투자의 책임은 본인에게 있습니다."
  ],
  "role": "실재하는 교육 업체의 다소 과장된 일방형 광고 페이지",
  "npcGoal": "유료 강의를 홍보하지만 투자금 송금이나 수익 보장은 하지 않는다.",
  "allowedClaims": ["수강료와 환불 규정 공개", "수익 비보장 고지", "과장된 마감 홍보"],
  "checks": {
    "library": "사업자와 환불 약관은 확인되지만 광고 후기 일부가 지나치게 선별돼 있습니다.",
    "cafe": "친구는 강의 내용이 기초적이었다며 가격 대비 가치는 낮았다고 말합니다."
  },
  "clueLabels": ["실제 업체와 환불 규정 존재", "과장 광고와 시간 압박은 주의"],
  "debrief": "사기로 확인되지는 않지만 광고가 과장됐고 충동 결제를 유도합니다. 안전하다는 뜻과 좋은 상품이라는 뜻은 다릅니다.",
  "safeAction": "결제를 미루고 커리큘럼·환불 규정·독립 후기를 비교합니다.",
  "displayUrl": "wallread-class.invalid/early",
  "linkLabel": "강의 소개 페이지 보기",
  "landingTitle": "초보자를 위한 4주 시장 읽기",
  "landingCopy": "수강료 89,000원 · 결제 후 7일 이내 미수강 강의 환불 가능 · 투자 수익은 보장되지 않습니다.",
  "landingCta": "수강 신청 검토",
  "review": {
    "sourceBasis": ["투자 교육 상품이 할인 마감과 성공 후기를 강조해 충동 결제를 유도하는 일반적인 광고 유형"],
    "adaptationScope": "실존 업체와 후기를 사용하지 않고 가격, 약관과 광고 문구를 가상으로 합성했습니다.",
    "verdictReason": "사업자와 환불 조건은 확인되지만 과장된 후기와 시간 압박 때문에 합리적인 비교가 필요해 주의로 분류합니다.",
    "verificationPaths": ["사업자 정보와 환불 약관 독립 확인", "광고와 무관한 수강 후기 및 대체 강의 비교"],
    "misdirection": ["오늘까지라는 할인 마감", "선별된 성공 후기", "정상 업체라면 좋은 상품일 것이라는 오해"],
    "learningObjectives": ["정상 거래와 좋은 구매 결정을 구분한다", "결제 전에 약관과 독립 후기를 비교한다"],
    "safetyAudit": { "containsPersonalData": false, "containsLiveUrl": false, "containsOperationalCrimeInfo": false }
  }
}
